{
  "id": "REC-template",
  "record_type": "scientific-visualization",
  "status": "draft",
  "created_at": "2026-09-29T00:00:00+00:00",
  "source_refs": [],
  "artifact_refs": [],
  "fields": {
    "visual_id": null,
    "scientific_question": null,
    "evidence_role": null,
    "source_results": null,
    "chart_or_table_type": null,
    "encoding_and_units": null,
    "uncertainty_and_n": null,
    "caption": null,
    "rendered_artifacts": null,
    "source_code": null,
    "visual_inspection": null,
    "borrowed_pattern_not_content": null
  }
}
